"rid","abstractText","abstractShort","title","manifestUrl","mainTitle","altTitle"
"MS-OR-00140","<p style='text-align: justify;'>Illuminated covers of an <i>Aṣṭasāhasrikā Prajñāpāramitā</i> manuscript, probably from the 12th century.</p>","Illuminated covers of an Aṣṭasāhasrikā Prajñāpāramitā manuscript, probably from the 12th century.","Aṣṭasāhasrikā Prajñāpāramitā","https://cudl.lib.cam.ac.uk/iiif/MS-OR-00140"
"MS-ADD-01662","<p style='text-align: justify;'> The <i>Pañcarakṣā</i> corpus (""Five Protections"") consists of the <i>Mahāpratisarā</i>, <i>Mahāmāyūrī</i>, <i>Mahāsāhasrapramardanī</i>, <i>Mahāmantrānusāriṇī</i>, and <i>Mahāśītavatī</i>. The earliest evidence for texts grouped together as the ""Five Great Dhāraṇīs"" comes from Tibetan catalogues around 800 CE, but this compendium is somewhat different from the surviving Sanskrit collection, which is preserved in manuscripts dating back to the eleventh century. These scriptures include spells, enumerations of benefits and ritual instructions for use. With the course of time all of them became deified and five related goddesses emerged. It is, however, important to note that the texts themselves do not have any references to these goddesses. This ancient palm leaf manuscript can be dated to approximately the 13th century CE. The last two folios are later supplies, still in palm leaf, dated to 1619 CE. Both wood covers are original and finely decorated with representations of the Buddhas and the goddesses of protection, which are now unfortunately badly damaged. </p>"," The Pañcarakṣā corpus (""Five Protections"") consists of the Mahāpratisarā, Mahāmāyūrī, Mahāsāhasrapramardanī, Mahāmantrānusāriṇī,","Pañcarakṣā","https://cudl.lib.cam.ac.uk/iiif/MS-ADD-01662"
"MS-OR-01814-00003","<p style='text-align: justify;'> A modern, illuminated Nepalese paper manuscript of the <i>Aparimitāyurdhāraṇīsūtra</i>, a popular text containig the spell of Aparimitāyus. It is taught by the Buddha to Mañjuśrī in Śrāvastī. Those who recite, copy or worship this text are granted longevity and will be reborn in Aparimitāyus’ buddha-field. </p>"," A modern, illuminated Nepalese paper manuscript of the Aparimitāyurdhāraṇīsūtra, a popular text containig the spell of Aparimitāyus.","Aparimitāyurdhāraṇīsūtra","https://cudl.lib.cam.ac.uk/iiif/MS-OR-01814-00003","Aparimitāyurdhāraṇīsūtra","Aparimitāyurdhāraṇīmahāyānasūtraratnarāja,Aparimitāyurnāmadhāraṇīmahāyānasūtra,Aparimitāyurnāmadhāraṇī"
"MS-ADD-02190","<p style='text-align: justify;'>A palm-leaf manuscript of the <i>Aṣṭasāhasrikā Prajñāpāramitā</i>.</p>","A palm-leaf manuscript of the Aṣṭasāhasrikā Prajñāpāramitā.","Aṣṭasāhasrikā Prajñāpāramitā","https://cudl.lib.cam.ac.uk/iiif/MS-ADD-02190"
"MS-ADD-01680-00002-00001","<p style='text-align: justify;'> The <i>Avadānaśataka</i> is an ancient collection of Buddhist legends, its first redaction dating to the first centuries of the CE. It was translated into Chinese and Tibetan during the first millennium CE, gaining large popularity across Asia. This Nepalese incomplete palm-leaf manuscript contains the beginning of the <i>Dharmapālāvadāna</i>, the thirty-third story in the collection. These two folios are part of a bundle of nine folios possibly from four different manuscripts, containing parts of five stories from the <i>Avadānaśataka</i>. They were used by Speyer for his edition of the <i>Avadānaśataka</i> and were given the siglum F. </p>"," The Avadānaśataka is an ancient collection of Buddhist legends, its first redaction dating to the first centuries of the","Avadānaśataka","https://cudl.lib.cam.ac.uk/iiif/MS-ADD-01680-00002-00001","Avadānaśataka","Śatakāvadāna"
"MS-ADD-01706-00003-00004","<p style='text-align: justify;'>A palm-leaf manuscript of the <i>Buddhapratimālakṣaṇa, Buddhapratimālakṣaṇavivaraṇa</i>.</p>","A palm-leaf manuscript of the Buddhapratimālakṣaṇa, Buddhapratimālakṣaṇavivaraṇa.","Buddhapratimālakṣaṇa, Buddhapratimālakṣaṇavivaraṇa","https://cudl.lib.cam.ac.uk/iiif/MS-ADD-01706-00003-00004"
"MS-ADD-01708-00001","<p style='text-align: justify;'>A palm-leaf manuscript of the <i>Nāmasaṅgītiṭikā</i>.</p>","A palm-leaf manuscript of the Nāmasaṅgītiṭikā.","Nāmasaṅgītiṭikā","https://cudl.lib.cam.ac.uk/iiif/MS-ADD-01708-00001"
"MS-ADD-00875","<p style='text-align: justify;'> A fundamental and very popular <i>sūtra</i> on various topics of <i>mahāyāna</i> Buddhism (philosophy, medicine, legends, <i>dhāraṇī</i>s etc.), dating to no later than the early 5th century CE. In Nepal it is considered to be one of the nine <i>dharma</i>s. According to the colophon, this manuscript was written in the late 18th century in Kathmandu during the reign of Raṇa Bahādur Shah (1775–1805), and commissioned by a certain Dhālasika as an object of worship. </p>"," A fundamental and very popular sūtra on various topics of mahāyāna Buddhism (philosophy, medicine, legends, dhāraṇīs etc.),","Suvarṇaprabhāsottamasūtra","https://cudl.lib.cam.ac.uk/iiif/MS-ADD-00875","Suvarṇaprabhāsottamasūtra","Suvarṇaprabhāsottamasūtrendrarāja,Suvarṇabhāsottamasūtra,Suvarṇaprabhāsa"
"MS-OR-00721","<p style='text-align: justify;'>A palm-leaf manuscript containing a ritual text.</p>","A palm-leaf manuscript containing a ritual text.","Pūjāvidhi","https://cudl.lib.cam.ac.uk/iiif/MS-OR-00721"
"MS-ADD-01469","<p style='text-align: justify;'>A paper manuscript of the <i>Madhyamasvayambhūpurāṇa with Newari Translation</i>.</p>","A paper manuscript of the Madhyamasvayambhūpurāṇa with Newari Translation.","Madhyamasvayambhūpurāṇa with Newari Translation","https://cudl.lib.cam.ac.uk/iiif/MS-ADD-01469"
"MS-OR-00153","<p style='text-align: justify;'> An old palm-leaf manuscript (13th century) of the <i>Aparimitāyurdhāraṇīsūtra</i>, a popular text containig the spell of Aparimitāyus. It is taught by the Buddha to Mañjuśrī in Śrāvastī. Those who recite, copy or worship this text are granted longevity and will be reborn in Aparimitāyus’ buddha-field. </p>"," An old palm-leaf manuscript (13th century) of the Aparimitāyurdhāraṇīsūtra, a popular text containig the spell of Aparimitāyus.","Aparimitāyurdhāraṇīsūtra","https://cudl.lib.cam.ac.uk/iiif/MS-OR-00153","Aparimitāyurdhāraṇīsūtra","Aparimitāyurdhāraṇīmahāyānasūtraratnarāja,Aparimitāyurnāmadhāraṇīmahāyānasūtra,Aparimitāyurnāmadhāraṇī"
"MS-ADD-01708-00003","<p style='text-align: justify;'>A palm-leaf manuscript of an <i>Unidentified Buddhist Tantra</i>.</p>","A palm-leaf manuscript of an Unidentified Buddhist Tantra.","Unidentified Buddhist Tantra","https://cudl.lib.cam.ac.uk/iiif/MS-ADD-01708-00003"
"MS-ADD-01585","<p style='text-align: justify;'>A paper manuscript of the <i>Sumāgadhāvadāna, Daśakuśala</i>.</p>","A paper manuscript of the Sumāgadhāvadāna, Daśakuśala.","Sumāgadhāvadāna, Daśakuśala","https://cudl.lib.cam.ac.uk/iiif/MS-ADD-01585"
"MS-ADD-01706-00009","<p style='text-align: justify;'>A palm-leaf manuscript of the <i>Śambarapañjikā</i>.</p>","A palm-leaf manuscript of the Śambarapañjikā.","Śambarapañjikā","https://cudl.lib.cam.ac.uk/iiif/MS-ADD-01706-00009"
"MS-ADD-01657-00003","<p style='text-align: justify;'>A fragment of the <i>Cāndravyākaraṇa</i> of the Buddhist grammarian Candragomin with its most widespread and best known commentary, the <i>Cāndravyākaraṇavṛtti</i>, for a long time believed to be the work of Candragomin himself, but now generally attributed to an author called Dharmadāsa , of which nothing else is known (Dash 1986; Oberlies 1989). In this manuscript each <i>sūtra</i> (i.e. rule) is separated from the commentary to the previous <i>sūtra</i> by a double <i>daṇḍa</i> followed by a small blank and another double <i>daṇḍa</i>, thus facilitating their identification despite the poor condition of the folios. The fragment contains a portion of the first section (<i>pāda</i>, literally “quarter”) of the fifth chapter (<i>adhyāya</i>), starting at some place before rule 5.1.16, <i>śenṅitoḥ</i>, which is legible, though barely, on <a href='' onclick='store.loadPage(1);return false;'>f. 1r4</a>, followed by rules 17, <i>jyāvraścapracchabhrasjāṃ</i>, <a href='' onclick='store.loadPage(1);return false;'>f. 1r4</a>; 18, <i>vaśas tiṅśity apiti</i>, <a href='' onclick='store.loadPage(1);return false;'>f. 1r5</a>; and 19, <i>vyaco ñṇityasi</i>, <a href='' onclick='store.loadPage(2);return false;'>f. 1v6</a>. The first rule identified by Bendall (1883: 159), namely 5.1.21, <i>liṭy aśver dvirukte</i>, appears on <a href='' onclick='store.loadPage(2);return false;'>f. 1v1</a>. In the rest of the manuscript the following <i>sūtra</i>s are legible, more or less clearly: 23, <i>svapaḥ</i>, <a href='' onclick='store.loadPage(2);return false;'>1v4</a>; 24, <i>caṅi</i>, <a href='' onclick='store.loadPage(2);return false;'>1v4</a>; 25, <i>yaṅi</i>, <a href='' onclick='store.loadPage(2);return false;'>1v5</a>; 26, <i>vyesyamoḥ</i>, <a href='' onclick='store.loadPage(2);return false;'>1v5</a>; 27, <i>cāyaḥ kīḥ</i>, <a href='' onclick='store.loadPage(2);return false;'>1v5]</a>; 28, <i>pres styaś ca tatavatoḥ</i>, <a href='' onclick='store.loadPage(2);return false;'>1v6</a>; 29, <i>sprśadravamūrtyoḥ śyaḥ</i>, <a href='' onclick='store.loadPage(2);return false;'>1v6</a>; 30, <i>prateḥ</i>, <a href='' onclick='store.loadPage(2);return false;'>1v7</a>; 34, <i>pyāyaḥ pīḥ</i>, <a href='' onclick='store.loadPage(3);return false;'>2r3</a>; 36, <i>liḍyaṅoḥ</i>, <a href='' onclick='store.loadPage(3);return false;'>2r5</a>; 37, <i>vā śveḥ</i>, <a href='' onclick='store.loadPage(3);return false;'>2r5</a>; 39, <i>hvaḥ</i>, <a href='' onclick='store.loadPage(4);return false;'>2v1</a>; 40, <i>dvitve</i>, <a href='' onclick='store.loadPage(4);return false;'>2v2</a>; 41, <i>na tasmin</i>, <a href='' onclick='store.loadPage(4);return false;'>2v3</a>; 42, <i>liṭi</i>, <a href='' onclick='store.loadPage(4);return false;'>2v4</a>; 43, <i>vayo yaḥ</i>, <a href='' onclick='store.loadPage(4);return false;'>2v5</a>; 44, <i>ver apiti vā</i>, <a href='' onclick='store.loadPage(4);return false;'>2v6</a>; 45, <i>lyapi ca</i>, <a href='' onclick='store.loadPage(4);return false;'>2v6</a>; 46, <i>jyaḥ</i>, <a href='' onclick='store.loadPage(5);return false;'>3r1</a>; 47, <i>vyaḥ</i>, <a href='' onclick='store.loadPage(5);return false;'>3r1</a>; 48, <i>parer vā</i>, <a href='' onclick='store.loadPage(5);return false;'>3r2</a>; 49, <i>eco śity āt_</i>, <a href='' onclick='store.loadPage(5);return false;'>3r2</a>; 50, <i>aliṭi¦ vyaḥ</i>, <a href='' onclick='store.loadPage(5);return false;'>3r4-3r5</a>; 51, <i>sphurisphulor ghañi</i>, <a href='' onclick='store.loadPage(5);return false;'>3r5</a>; 52, <i>dīṅo</i> <i class='error' style='font-style:normal;' title='This text in error in source'> <i>’kṅitsan</i> </i><i class='delim' style='font-style:normal; color:red'>(!)</i> <i>lyapi</i>, <a href='' onclick='store.loadPage(5);return false;'>3r6</a>; 53, <i>mimyor akhalaci</i>, <a href='' onclick='store.loadPage(5);return false;'>3r7</a>; 54, <i>liyo vā</i>, <a href='' onclick='store.loadPage(6);return false;'>3v1</a>; 55, <i>apaguro ṇamuli</i>, <a href='' onclick='store.loadPage(6);return false;'>3v3</a>; 56, <i> <i class='delim' style='font-style:normal; color:red'>[</i><i class='damage' style='font-style:normal;' title='This text damaged in source'>-1-</i><i class='delim' style='font-style:normal; color:red'>]</i>sphuror ṇau</i>, <a href='' onclick='store.loadPage(6);return false;'>3v4</a>; 57, <i>prajane viyaḥ</i>, <a href='' onclick='store.loadPage(6);return false;'>3v4</a>; 58, <i>bhiyaḥ</i> <i class='error' style='font-style:normal;' title='This text in error in source'> <i>prajojakāt_</i> </i><i class='delim' style='font-style:normal; color:red'>(!)</i>, <a href='' onclick='store.loadPage(6);return false;'>3v5</a>; 59, <i>smeś ca</i>, <a href='' onclick='store.loadPage(6);return false;'>3v6</a>; 60, <i class='error' style='font-style:normal;' title='This text in error in source'> <i>krīṅjīnā</i> </i><i class='delim' style='font-style:normal; color:red'>(!)</i>, <a href='' onclick='store.loadPage(6);return false;'>3v7</a>; 61, <i class='error' style='font-style:normal;' title='This text in error in source'> <i>aṣṭivuṣvaskādeḥ ṣas saḥ</i> </i><i class='delim' style='font-style:normal; color:red'>(!)</i>, <a href='' onclick='store.loadPage(7);return false;'>4r2</a>; 62, <i>ṇo naḥ</i>, <a href='' onclick='store.loadPage(7);return false;'>4r4</a>; 63, <i>yo vali lopaḥ</i>, <a href='' onclick='store.loadPage(7);return false;'>4r5</a>; (<i>sūtra</i> 64, <i>ver anacaḥ</i> is omitted, certainly due to a scribal mistake, as the commentary on rule 63 is incomplete but, after a <i>daṇḍa</i>, the text continues with the final part of the commentary on <i>sūtra</i> 64); 65, <i>halas tipsipaḥ</i>, <a href='' onclick='store.loadPage(7);return false;'>4r6</a>; 66, <i>soḥ</i>, <a href='' onclick='store.loadPage(7);return false;'>4r7</a>; 67, <i>ṅyāpo dirghāt</i>, <a href='' onclick='store.loadPage(7);return false;'>4r7</a>; 68, <i>eṅ hrasvāt sambuddhāv ataḥ</i>, <a href='' onclick='store.loadPage(7);return false;'>4r8</a>; 69, <i>hrasvasyātiṅi piti tuk</i>, <a href='' onclick='store.loadPage(8);return false;'>4v2</a>; 70, <i class='error' style='font-style:normal;' title='This text in error in source'> <i>phe</i> </i><i class='delim' style='font-style:normal; color:red'>(!)</i>, <a href='' onclick='store.loadPage(8);return false;'>4v4</a>; 71, <i>āṅmāṅah</i>, <a href='' onclick='store.loadPage(8);return false;'>4v4</a>; 72, <i>dīrghasya</i>, <a href='' onclick='store.loadPage(8);return false;'>4r5</a>; 73, <i>padāntasya vā</i>, <a href='' onclick='store.loadPage(8);return false;'>4v5</a>; 74, <i>iko yaṇ aci</i>, <a href='' onclick='store.loadPage(8);return false;'>4v6</a>; 75, <i> <i class='delim' style='font-style:normal; color:red'>[</i><i class='unclear' style='font-style:normal;' title='This text imperfectly legible in source'>eco ’yavāyāvaḥ</i><i class='delim' style='font-style:normal; color:red'>]</i> </i>, <a href='' onclick='store.loadPage(8);return false;'>4v7</a>. The last legible sutra is 5.1.76, <i>yi pare ’vāvau</i> on <a href='' onclick='store.loadPage(8);return false;'>f. 4v7</a>. The rest of the chapter, which comprises 142 <i>sūtra</i>s, is lost. The manuscript is badly damaged, but the readable portions correspond quite closely to the printed edition of the <i>Cāndravyākaraṇavṛtti</i> (Chatterji 1965). </p>","A fragment of the Cāndravyākaraṇa of the Buddhist grammarian Candragomin with its most widespread and best known commentary,","Cāndravyākaraṇavṛtti","https://cudl.lib.cam.ac.uk/iiif/MS-ADD-01657-00003","Cāndravyākaraṇavṛtti","Cāndravṛtti"
"MS-ADD-01648","<p style='text-align: justify;'>A palm-leaf manuscript of the <i>Sādhanasamuccaya</i>.</p>","A palm-leaf manuscript of the Sādhanasamuccaya.","Sādhanasamuccaya","https://cudl.lib.cam.ac.uk/iiif/MS-ADD-01648"
"MS-ADD-01686","<p style='text-align: justify;'>This incomplete palm-leaf manuscript from the twelfth century is among the earliest ones preserving the <i>Sādhanamālā</i>, an extensive collection of rituals dedicated to various divinities of the Buddhist pantheon. It is one of the eight codices used by B. Bhattacharya for the editio princeps of this text published in 1925-1928. </p>","This incomplete palm-leaf manuscript from the twelfth century is among the earliest ones preserving the Sādhanamālā, an extensive","Sādhanamālā","https://cudl.lib.cam.ac.uk/iiif/MS-ADD-01686"
"MS-ADD-01680-00008-00001","<p style='text-align: justify;'>This fragmentary palm-leaf manuscript of a <i>Dhāraṇīsaṃgraha</i> is part of a bundle of a few manuscripts (Add.1680.8), all seemingly composed of collections of <i>dhāraṇī</i>s. Three different manuscripts, all from around the 12th-13th century, have been tentatively identified on the basis of the (often deficient) foliation and of the layout (string hole in a square blank space, string hole in a column-like blank space or an alternation of the two). Further research might shed more light on the subdivision of the whole manuscript bundle. This identified manuscript has 15 folio. The foliation of some of them is repeated; therefore, they might have originally belonged to different manuscripts. Two folios are beautifully illuminated. </p>","This fragmentary palm-leaf manuscript of a Dhāraṇīsaṃgraha is part of a bundle of a few manuscripts (Add.1680.8), all seemingly","Dhāraṇīsaṃgraha","https://cudl.lib.cam.ac.uk/iiif/MS-ADD-01680-00008-00001"
"MS-OR-00715-00004","<p style='text-align: justify;'> This fragmentary palm-leaf manuscript is part of a bundle of a few manuscripts (Or.715), all seemingly composed of collections of <i>Buddhist <i>stotra</i>s</i>. Five different manuscripts, all from around the 12th-13th century, have been tentatively identified on paleographical and codicological grounds. Further research might shed more light on the subdivision of the whole manuscript bundle. A surviving colophons refers to the <i>Avalokiteśvarabhaṭṭārakasya Khasarpaṇastotra</i>. </p>"," This fragmentary palm-leaf manuscript is part of a bundle of a few manuscripts (Or.715), all seemingly composed of collections","Śrīmatāryāvalokiteśvarabhaṭṭārakasya Khasarpaṇastotram","https://cudl.lib.cam.ac.uk/iiif/MS-OR-00715-00004"
"MS-OR-00158-00002","<p style='text-align: justify;'>A palm-leaf manuscript of the <i>Buddhakapālatantra</i>.</p>","A palm-leaf manuscript of the Buddhakapālatantra.","Buddhakapālatantra","https://cudl.lib.cam.ac.uk/iiif/MS-OR-00158-00002"
"MS-ADD-01590","<p style='text-align: justify;'>A paper manuscript of the <i>Kalpadrumāvadānamālā</i>.</p>","A paper manuscript of the Kalpadrumāvadānamālā.","Kalpadrumāvadānamālā","https://cudl.lib.cam.ac.uk/iiif/MS-ADD-01590"
"MS-ADD-01472","<p style='text-align: justify;'> This quite recent manuscript (18th or 19th century) contains the <i>Vṛṣṭicintāmaṇi</i>, a ""charm for rain in 34 numbered sections or stanzas"" (Bendall 1883: 103), composed by Rāja Jayapratāpa Malla (1641-1674). In this <i>stotra</i> (""poem of praise""), the heroic <i>śaiva</i> king claims mastery of the Buddhist world by descending into the <i>sancta sanctorum</i> of the great Buddhist <i>stūpa</i> of Svayambhū and by besting the <i>nāga</i>s in order to bring rain to a drought-stricken country. </p>"," This quite recent manuscript (18th or 19th century) contains the Vṛṣṭicintāmaṇi, a ""charm for rain in 34 numbered sections","Vṛṣṭicintāmaṇi","https://cudl.lib.cam.ac.uk/iiif/MS-ADD-01472"
"MS-OR-00716-00001","<p style='text-align: justify;'>A partial palm-leaf manuscript of an unidentified Buddhist Tantric work.</p>","A partial palm-leaf manuscript of an unidentified Buddhist Tantric work.","Unidentified Buddhist Tantric Work","https://cudl.lib.cam.ac.uk/iiif/MS-OR-00716-00001"
"MS-ADD-00994","<p style='text-align: justify;'>A palm-leaf manuscript of the <i>Vyāsakāra with a Sinhala commentary</i>.</p>","A palm-leaf manuscript of the Vyāsakāra with a Sinhala commentary.","Vyāsakāra with a Sinhala commentary","https://cudl.lib.cam.ac.uk/iiif/MS-ADD-00994"
"MS-ADD-00864","<p style='text-align: justify;'>A masterfully crafted 17th-century Nepalese accordion book, completely consisting of polychrome drawings, for a total of one-hundred and forty-four illuminated pages of an extremely vivid grace and an exuberant, expressionistic character. The paintings represent stories of both sacred and secular nature, often narrated along multiple pages, sometimes divided in two or three frames with the story evolving and the movement shifting from one composition to another. The stories are mostly taken from Brahmanical sources (the <i>Bhāgavatapurāṇa</i>, the <i>Mahābhārata</i>, the <i>Rāmāyaṇa</i> and the <i>Vetālapañcaviṃśati</i>) with the exception of ""the Buddhist Kinnarī Jātaka, a subject of abiding interest in Nepal. (Pal 1978: 98)"" The pictures are often endowed with captions in Sanskrit, sometimes mixed with Newari words, in Nepālākṣarā script. Some folios display representations of some of the Mahāsiddhas, while others show horses from the <i>Aśvaśāstra</i> and sevaral scenes with various animals. This comparatively rare typology of manuscript, completely given over to pictures, is usually dubbed as <i>Kalāpustaka</i>. Some other instances of thoroughly illuminated books are known from Nepal, but only a manuscript from the National Art Gallery at Bhadgaon matches the present manuscript in beauty and elaboration. The date of the present manuscript is established on both paleographical and iconographical grounds on the basis of close similarities to the Bhatgaon manuscript, which is dated 1594 CE. As Pal (1967: 32) argues, ""considering the richness and superb qualities"" of its paintings, it is likely that this manuscript has ""been a royal commission, probably of king Jayajitāmitramalla around the year A.D. 1600."" </p>","A masterfully crafted 17th-century Nepalese accordion book, completely consisting of polychrome drawings, for a total of","Kalāpustaka","https://cudl.lib.cam.ac.uk/iiif/MS-ADD-00864"
